link,section,date,title,nb_up,nb_down,nb_comments
https://9gag.com/gag/agg6MNx,Funny,2022-06-12 11:52:23.325707,At least I don't have bieber fever,16,54,18
https://9gag.com/gag/aDDqA7Z,Gaming,2022-06-12 16:52:23.325707,What's not to love? Still the best AC game after they killed Desmond imo,1400,125,77
https://9gag.com/gag/awzPqdQ,Funny,2022-06-12 11:52:23.325707,Share your darkest Sesame street memes,8400,659,354
https://9gag.com/gag/aGzr9P7,WTF,2022-06-12 21:52:23.325707,Wedding in Uzbekistan,28,60,36
https://9gag.com/gag/a31zPV8,Random,2022-06-12 18:52:23.325707,"To repent, we must admit to ourselves that we have sinned. The confession booth is open..",8,15,9
https://9gag.com/gag/a118vG6,Animals,2022-06-12 18:52:23.325707,🦝 are awesome! 💕,16,45,3
https://9gag.com/gag/aZro9XW,Funny,2022-06-12 11:52:23.325707,The Golden Ratio,123,28,12
https://9gag.com/gag/apgze75,Random,2022-06-12 11:52:23.325707,Anne Franks diary became famous all over the world,26,37,24
https://9gag.com/gag/a31emb5,Funny,2022-06-12 11:52:23.325707,That's not a Human....,73,34,13
https://9gag.com/gag/awzPwY8,Funny,2022-06-12 11:52:23.325707,All Diablo Immortal palyers RN,31,8,7
https://9gag.com/gag/apgzO6M,Gaming,2022-06-12 11:52:23.325707,Grabbed by zombies,29,50,10
https://9gag.com/gag/aQXBGee,Awesome,2022-06-12 11:52:23.325707,Hitler watching 1936 Olympics high on dexamphetamine,613,52,77
https://9gag.com/gag/apgz4NM,Funny,2022-06-12 11:52:23.325707,Ooppssssss,152,122,36
https://9gag.com/gag/a91ZZQD,Satisfying,2022-06-11 11:52:23.325707,Deserved,512,58,61
https://9gag.com/gag/aAGqqdE,WTF,2022-06-10 11:52:23.325707,Old times,149,169,49
https://9gag.com/gag/a6144bm,Random,2022-06-10 11:52:23.325707,Be Kind,2000,302,59
https://9gag.com/gag/a2199rZ,Funny,2022-06-10 11:52:23.325707,Oooh...that level,3000,46,185
https://9gag.com/gag/aAGqqdL,Random,2022-06-10 11:52:23.325707,Washed and unwashed 'fish',320,30,43
https://9gag.com/gag/aQXBOBe,Random,2022-06-10 11:52:23.325707,Just a thing,40,22,25
https://9gag.com/gag/aNP83R4,Funny,2022-06-10 11:52:23.325707,If you are sad...,2300,243,98
https://9gag.com/gag/aAGqv20,Random,2022-06-10 11:52:23.325707,Well that escalated quickly…,8,33,18
https://9gag.com/gag/a0ZzOEv,Funny,2022-06-10 11:52:23.325707,Flex much,91,41,29
https://9gag.com/gag/avA4dXM,Funny,2022-06-10 11:52:23.325707,Life is not fair,23,7,8
https://9gag.com/gag/ang8rWL,Funny,2022-06-10 11:52:23.325707,Time to go swimming,577,39,101
https://9gag.com/gag/avA4d7W,Funny,2022-06-10 11:52:23.325707,"So, is it gay or not?",26,16,26
https://9gag.com/gag/aOQARzM,Random,2022-06-10 11:52:23.325707,Prom in Ukraine,135,34,17
https://9gag.com/gag/a11BLYY,Random,2022-06-09 11:52:23.325707,Those who keeps complaining portrait mode. App name- Force rotation (android),3,42,20
https://9gag.com/gag/a91ZXPD,Comic & Webtoon,2022-06-09 11:52:23.325707,Animal,947,29,20
https://9gag.com/gag/a41mqLm,WTF,2022-06-09 11:52:23.325707,"Now you see me now you don't, boxing style",402,61,63
https://9gag.com/gag/aQXB2nK,Funny,2022-06-09 11:52:23.325707,Man gets mobbed by animals.,145,36,30
https://9gag.com/gag/amgKmxX,Funny,2022-06-09 11:52:23.325707,"Bodybuilders are gay, apparently.",22,29,23
https://9gag.com/gag/awzPOA1,WTF,2022-06-09 11:52:23.325707,Yes he's single!,83,35,10
https://9gag.com/gag/ang8x9V,Funny,2022-06-09 11:52:23.325707,Red Luigi & Green Mario,21,3,1
https://9gag.com/gag/a91ZmK0,Funny,2022-06-09 11:52:23.325707,It’s for a good reason,95,47,10
https://9gag.com/gag/aXrQ79V,Funny,2022-06-09 11:52:23.325707,I do that.A Lot.,719,20,18
https://9gag.com/gag/abgKxZB,Funny,2022-06-09 11:52:23.325707,She had a REALLY good weekend.,52,13,10
https://9gag.com/gag/a31e8je,WTF,2022-06-09 11:52:23.325707,Looks like the tree absorbed someone,439,46,36
https://9gag.com/gag/a11BVY8,Awesome,2022-06-09 11:52:23.325707,Carl Weathers before he played in the Rocky movie franchise.,54,13,7
https://9gag.com/gag/a71P97r,Funny,2022-06-09 11:52:23.325707,Find someone that you are but treats are.,11,28,9
https://9gag.com/gag/ay9Z1dq,Relationship,2022-06-09 11:52:23.325707,"Seriously, they keep broadcasting how good they are, but act so ruthless and aren't even aware of the damage they cause.",87,25,53
https://9gag.com/gag/aPZzeyq,Gaming,2022-06-09 11:52:23.325707,After 27 years... Today is the day I join the PC master race,202,36,65
https://9gag.com/gag/a81QeW1,Wholesome,2022-06-09 11:52:23.325707,"I know I’m setting myself up for abuse that will not stop, but I challenge anyone to find a better Disney cartoon movie than this",17,32,29
https://9gag.com/gag/aLvVAQ6,WTF,2022-06-09 11:52:23.325707,Idk if it's been posted here before...,84,29,33
https://9gag.com/gag/aegyVWm,Funny,2022-06-09 11:52:23.325707,When you have adblock turned on in real life,691,31,15
https://9gag.com/gag/aXrQvd2,Movie & TV,2022-06-07 11:52:23.325707,Constantine,13000,340,477
https://9gag.com/gag/a41m5Ny,Funny,2022-06-09 11:52:23.325707,Puerto Rico,12,54,19
https://9gag.com/gag/aWgPvvZ,WTF,2022-06-09 11:52:23.325707,Which logic?,759,56,72
https://9gag.com/gag/a219yyw,Animals,2022-06-09 11:52:23.325707,This is the derpy face Luna makes when you wake her up.,31,9,3
https://9gag.com/gag/aE8yoWx,WTF,2022-06-09 11:52:23.325707,And they want equal pay ...,128,88,36
https://9gag.com/gag/aWgPvox,Meme,2022-06-09 11:52:23.325707,It's stronger than me,39,129,44
https://9gag.com/gag/a81QD2Z,Awesome,2022-06-09 11:52:23.325707,Wanna cry about how hard your 1st world life is some more?,102,34,31
https://9gag.com/gag/a31p6A3,Gaming,2022-06-04 00:00:00.000000,Blasphemous Game has a dark souls vibe,2000,117,118
https://9gag.com/gag/aXrQgjd,Funny,2022-06-08 11:52:23.325707,When someone asks why linux,1400,66,122
https://9gag.com/gag/a81Q5O1,Funny,2022-06-07 11:52:23.325707,John Wayne was right,3600,142,102
https://9gag.com/gag/aAGNnY0,Random,2022-06-04 00:00:00.000000,Feels good,8400,310,481
https://9gag.com/gag/aZroyLW,Latest News,2022-06-08 11:52:23.325707,Berserk raising from the dead,6500,320,638
https://9gag.com/gag/aZroypQ,Funny,2022-06-07 11:52:23.325707,Emma watson un speech,11000,541,906
https://9gag.com/gag/aWgPO42,Funny,2022-06-05 00:00:00.000000,Pc is missing,7200,122,206
https://9gag.com/gag/aZrVGnp,Relationship,2022-06-04 00:00:00.000000,I dont know how,2400,106,75
https://9gag.com/gag/aggZP6n,Latest News,2022-06-04 00:00:00.000000,Hahaha don’t worries,2900,204,59
https://9gag.com/gag/amgKNGv,Random,2022-06-05 00:00:00.000000,Tiananmen MASSACRE Tankman,2100,61,89
https://9gag.com/gag/aRr960q,Star Wars,2022-06-05 00:00:00.000000,You hate Reva because you are virgin and a racist,25,201,53
https://9gag.com/gag/agg6rLg,Funny,2022-06-05 00:00:00.000000,And when he turns back around kiss him on the lips.,98,31,6
https://9gag.com/gag/a51vpbV,Funny,2022-06-05 00:00:00.000000,"Oh, yes.. please. Someone 3d this awesome man.",12,9,9
https://9gag.com/gag/a91ZjrZ,WTF,2022-06-05 00:00:00.000000,Do it coward,148,203,18
https://9gag.com/gag/arn91Gy,WTF,2022-06-05 00:00:00.000000,Well... He's right,42,33,24
https://9gag.com/gag/aNP8mKb,Random,2022-06-05 00:00:00.000000,Hello ladies plz get yourself a man who can do both😍,5,196,31
https://9gag.com/gag/aegPXXQ,Random,2022-06-05 00:00:00.000000,I'm tired of this fan shit😡 they surround me wherever i go😡 it's quite of a task when you are a famous personality 😡 not everyone can handle the fame😡,2,179,32
https://9gag.com/gag/aegPoBQ,WTF,2022-06-04 00:00:00.000000,Do’nt,13,34,10
https://9gag.com/gag/aXrGD69,Funny,2022-06-04 00:00:00.000000,Furry with a shotgun,20,93,42
https://9gag.com/gag/aGzN34n,Movie & TV,2022-06-04 00:00:00.000000,Got a new tattoo.,26,37,23
https://9gag.com/gag/a41reOm,Movie & TV,2022-06-04 00:00:00.000000,"Oh yeah, it's morbin' time 😎",11,40,7
https://9gag.com/gag/avAXYKX,Funny,2022-06-04 00:00:00.000000,Kangaroos seem like real assholes,50,14,18
https://9gag.com/gag/aggZMb6,Funny,2022-06-04 00:00:00.000000,We’re looking at you America,547,65,15
https://9gag.com/gag/angWp7q,Ask 9GAG,2022-06-04 00:00:00.000000,If you'd like to view your public stats let me know. More metrics to come.,3,17,23
https://9gag.com/gag/axBnxBb,Meme,2022-06-04 00:00:00.000000,I wish...,33,34,7
https://9gag.com/gag/apgjWD8,Funny,2022-06-04 00:00:00.000000,A power only few can achieve...,156,59,23
https://9gag.com/gag/aXrGBGd,WTF,2022-06-04 00:00:00.000000,"Alright, first episode and its already...",18,46,9
https://9gag.com/gag/azeD0Kq,Comic & Webtoon,2022-06-04 00:00:00.000000,The chinese treatment for liberty fever,19,7,8
https://9gag.com/gag/aogqoPm,Gaming,2022-06-03 00:00:00.000000,"Strong, united, working 'til we fall... *whistling intensifies",33,22,9
https://9gag.com/gag/a91Nonj,Funny,2022-06-04 00:00:00.000000,"This is not ME, YOU ARE! (😭)",3,137,7
https://9gag.com/gag/a716xnw,Funny,2022-06-03 00:00:00.000000,Don't put your d*ick in crazy,596,104,44
https://9gag.com/gag/awzG2m1,WTF,2022-06-03 00:00:00.000000,Came across this gem today,114,33,35
https://9gag.com/gag/aXrG1Pb,Movie & TV,2022-06-03 00:00:00.000000,Morb deeznuts,15,47,4
https://9gag.com/gag/aggZwmq,Funny,2022-06-03 00:00:00.000000,Funeral in a Movie StarterPack,22,16,3
https://9gag.com/gag/aNP25DA,Funny,2022-06-03 00:00:00.000000,"""You haven't seen Morbius?"" starter pack",7,38,12
https://9gag.com/gag/a21jpvZ,WTF,2022-06-03 00:00:00.000000,Woman faints and falls into the gap between a moving train and the platform at the Independencia station near Buenos Aires and somehow survives without injuries,191,20,23
https://9gag.com/gag/a81XNGQ,Comic & Webtoon,2022-06-03 00:00:00.000000,That campaign took a strange turn,89,91,24
https://9gag.com/gag/aZrVKg3,Awesome,2022-06-03 00:00:00.000000,When fatigue is higher than hunger,6700,124,161
https://9gag.com/gag/avAX4Pb,Gaming,2022-06-03 00:00:00.000000,"Nobody saw that coming, not even on GeForce Leak",2900,235,438
https://9gag.com/gag/aZrVoB0,Funny,2022-06-03 00:00:00.000000,Forced diversity is real,698,92,14
https://9gag.com/gag/a716PZq,Random,2022-06-03 00:00:00.000000,Feed the fis........shit,604,18,15
https://9gag.com/gag/aAGNq19,WTF,2022-06-03 00:00:00.000000,"Average weight is 60-80 kgs. You have to lift it with your teeth, neck and waist",217,105,68
https://9gag.com/gag/aqGpBZv,Funny,2022-06-03 00:00:00.000000,I guess I downloaded the wrong remake,429,79,17
https://9gag.com/gag/a41rxnp,Funny,2022-06-02 00:00:00.000000,"9gag doesnt allow me to change my gender, asking me to wait 9 years to do. Is this related to the recent “pride” events?",11,48,22
https://9gag.com/gag/a11q1PD,Funny,2022-05-31 00:00:00.000000,Bring out the Next Stack !!!,6300,139,140
https://9gag.com/gag/arnrnOp,Funny,2022-05-31 00:00:00.000000,Good samaritans let pedestrians cross the street...,7200,415,277
https://9gag.com/gag/a21j13d,Funny,2022-05-31 00:00:00.000000,"In transformers (2007) , Sam screams in fear when he first encounters a transformer , this is because Sam is transphobic.",5900,223,119
https://9gag.com/gag/aNP2wKA,WTF,2022-05-31 00:00:00.000000,HUR DUR,5700,97,220
https://9gag.com/gag/aNP2wQw,Funny,2022-05-31 00:00:00.000000,How the turntables,7100,701,701
https://9gag.com/gag/aNP2DW6,Gaming,2022-05-31 00:00:00.000000,What about necromancer pets?,2900,72,88
https://9gag.com/gag/ajgMP4q,Funny,2022-05-31 00:00:00.000000,Subrim,8600,224,1300
https://9gag.com/gag/aM4NVpM,Meme,2022-05-31 00:00:00.000000,Example: Montgomery de la Cruz - 13 Reasons Why,70,19,53
https://9gag.com/gag/aLvNnqx,Random,2022-05-31 00:00:00.000000,"Poor Pepe, he didn’t deserve that.",53,19,35
https://9gag.com/gag/aggZQ3n,Funny,2022-05-31 00:00:00.000000,It was at this moment Juan knew he f**ked up,560,27,17
https://9gag.com/gag/aWgNgL2,Funny,2022-05-31 00:00:00.000000,"Time will pass , will you??",3300,135,257
https://9gag.com/gag/azeBw3m,Latest News,2022-05-26 00:00:00.000000,Just in Ray Liotta dead at age 67. Died during his sleep.,12000,503,840
https://9gag.com/gag/aqGd0LR,Latest News,2022-05-27 00:00:00.000000,Shanghai still doesn’t get any better. Well maybe on comedy,1300,34,43
https://9gag.com/gag/axBALq2,Funny,2022-05-27 00:00:00.000000,Still only counts as one,4100,205,114
https://9gag.com/gag/avADN4n,Random,2022-05-27 00:00:00.000000,What are you really looking for?,2900,202,79
https://9gag.com/gag/aPZpNvw,Random,2022-05-27 00:00:00.000000,The first thing I thought of when I saw Amber's sister. Did they 3d model her?,1000,83,63
https://9gag.com/gag/aOQjX8v,Superhero,2022-05-27 00:00:00.000000,Shaggy unleashed,3000,126,64
https://9gag.com/gag/ajgdbW8,WTF,2022-05-27 00:00:00.000000,"Some walking dead $hit, dafuuuuuuuuq?",2000,140,380
https://9gag.com/gag/aM4WpMR,Awesome,2022-05-27 00:00:00.000000,Wish me luck guys!,1300,191,206
https://9gag.com/gag/aRry55B,Awesome,2022-05-27 00:00:00.000000,"Dang amazing, the fella who made this should get a reward",4000,211,87
https://9gag.com/gag/axBApWL,Awesome,2022-05-27 00:00:00.000000,One of three Border Patrol agents that stopped the TX school shooter while the cops cowered in fear. A bullet grazing his head did not stop this real man.,2700,131,272
https://9gag.com/gag/a51xLLL,WTF,2022-05-27 00:00:00.000000,"Cone God: savior of cones, stopper of cars",2800,193,115
https://9gag.com/gag/aegdXX5,Random,2022-05-27 00:00:00.000000,Dress conservatively around your randy uncle,8500,500,685
https://9gag.com/gag/adgdr5j,Funny,2022-05-25 00:00:00.000000,Oof. You tried Eleine! A+ for effort!,1600,168,61
https://9gag.com/gag/ajgdMR1,Funny,2022-05-25 00:00:00.000000,"I hear clapping, but not of hands",3600,207,100
https://9gag.com/gag/a0ZxxWz,WTF,2022-05-25 00:00:00.000000,CUCK ka doodle do,10000,370,730
https://9gag.com/gag/ay9zmAV,Random,2022-05-26 00:00:00.000000,"""Source material""? Never heard of it.",1400,63,81
https://9gag.com/gag/a11xnpY,WTF,2022-05-26 00:00:00.000000,"Well, I'm still here.",1600,52,84
https://9gag.com/gag/a81n9Zp,Funny,2022-05-26 00:00:00.000000,You can do it!,7500,303,688
https://9gag.com/gag/aZrdKen,WTF,2022-05-26 00:00:00.000000,Characters in this movie speak Latin like how the Romans actually used to speak.,6700,275,743
https://9gag.com/gag/ajgdvPg,Funny,2022-05-26 00:00:00.000000,Hol up little one...,10000,177,222
https://9gag.com/gag/a71Gpmx,Funny,2022-05-25 00:00:00.000000,Think real hard,6200,166,149
https://9gag.com/gag/apgdVY9,WTF,2022-05-25 00:00:00.000000,I’m something of a winner myself,9100,215,164
https://9gag.com/gag/a21xG3D,WTF,2022-05-25 00:00:00.000000,I will Repost again,3900,307,231
https://9gag.com/gag/aE8QEEe,Funny,2022-05-25 00:00:00.000000,Love these memes,5300,208,143
https://9gag.com/gag/a11xw5w,Funny,2022-05-25 00:00:00.000000,Fight..,5000,209,140
https://9gag.com/gag/aGzoo20,Funny,2022-05-25 00:00:00.000000,"They were so busy with Krystal from Starfox lately, barely finding Falco humping buildings on that page anymore",2500,65,101
https://9gag.com/gag/aOQjGgR,WTF,2022-05-25 00:00:00.000000,"Adriana Karembeu and Jamel Debbouze, presenting at the Cesar Awards (1999)",2800,115,202
https://9gag.com/gag/avADmmE,Movie & TV,2022-05-25 00:00:00.000000,“The Halo TV series is the gold standard for video game adaptations”? What a f**king joke.,6000,335,834
https://9gag.com/gag/adgd2qZ,Funny,2022-05-24 00:00:00.000000,Harry Harry Harry....,3300,348,80
https://9gag.com/gag/ay9z1XW,Wholesome,2022-05-24 00:00:00.000000,A Boy caught on CCTV camera running into his neighbor's garage to hug their dog.,7600,211,124
https://9gag.com/gag/apgdx4n,Funny,2022-05-24 00:00:00.000000,It's like a DejaVu,9700,194,137
https://9gag.com/gag/avADEDn,Random,2022-05-24 00:00:00.000000,Pick up today 50kg of garbage. Total is 821kg. You ask me where all this garbage goes after my cleaning. City service pick it up in special place and than it goes to Garbage Factory. Your Cleaning Guy Petr Tyurin.,9600,817,380
https://9gag.com/gag/aegdxLW,Gaming,2022-05-24 00:00:00.000000,"My first gaming pc, what do guys think? (A friend got me the parts bc i have no clue about computers... how good would you say is it?",19,30,37
https://9gag.com/gag/aDDPbex,Funny,2022-05-24 00:00:00.000000,Stupid games,57,32,22
https://9gag.com/gag/aNPqB7r,Awesome,2022-05-24 00:00:00.000000,Guess the country,42,10,36
https://9gag.com/gag/aM4W2zx,Movie & TV,2022-05-20 00:00:00.000000,Possibly one of the (few) best Netflix originals,10000,904,942
https://9gag.com/gag/aGzoRpw,Funny,2022-05-20 00:00:00.000000,KEEP GRINDING focus on yourself,2800,194,159
https://9gag.com/gag/a81nWw6,Random,2022-05-20 00:00:00.000000,Fitness training of the Polish army,10000,452,805
https://9gag.com/gag/aQXrpW7,Latest News,2022-05-20 00:00:00.000000,I hope some more will join her,18000,616,1500
https://9gag.com/gag/abgd0qv,WTF,2022-05-21 00:00:00.000000,Quadruel?,1000,73,95
https://9gag.com/gag/aogd9dx,Gaming,2022-05-21 00:00:00.000000,Ugly Sonic Appeared in Chip 'n Dale: Rescue Rangers,1000,45,43
https://9gag.com/gag/aAGm1A9,Meme,2022-05-21 00:00:00.000000,Seeing the positives,1300,113,102
https://9gag.com/gag/aVxdD7n,Funny,2022-05-21 00:00:00.000000,Age of consent,1100,81,346
https://9gag.com/gag/aAGZMgo,Relationship,2022-05-16 00:00:00.000000,Take the bad with the good,2300,101,111
https://9gag.com/gag/aRryj9j,Gaming,2022-05-21 00:00:00.000000,"Bethesda Bethesda Bethesda,",3400,114,42
https://9gag.com/gag/ay9P9RW,Meme,2022-05-15 00:00:00.000000,"The lion, the witch and",2600,140,98
https://9gag.com/gag/arnzmn7,Funny,2022-05-15 00:00:00.000000,It was never real money anyway,1400,97,88
https://9gag.com/gag/a91By9D,Funny,2022-05-15 00:00:00.000000,9GAGgers who get the seks…,1100,51,55
https://9gag.com/gag/aM4yVzR,Funny,2022-05-15 00:00:00.000000,Master cheeks,4300,228,433
https://9gag.com/gag/aVxBgQO,Funny,2022-05-15 00:00:00.000000,It's called a discharge for a reason,5100,175,200
https://9gag.com/gag/aDDM6eO,Savage,2022-05-16 00:00:00.000000,Cowabunga Dude! Pizza Is Ready!,979,103,97
https://9gag.com/gag/apg8D8D,Funny,2022-05-16 00:00:00.000000,Rosa rosa rosam,1900,82,79
https://9gag.com/gag/aWg9pNZ,Funny,2022-05-16 00:00:00.000000,Chicago,2900,155,309
https://9gag.com/gag/a11wNmv,Awesome,2022-05-16 00:00:00.000000,"One of the most badass scenes in cinema history, this is the birth of the antihero.",6700,194,348
https://9gag.com/gag/a21Gvop,Funny,2022-05-15 00:00:00.000000,YT is turning on their own content creators and turning into hot pile of turd in summer,15000,295,1600
https://9gag.com/gag/aVxBgYv,Ask 9GAG,2022-05-15 00:00:00.000000,If only I could have tips on how to make it a permanent thing..,8700,369,1100
https://9gag.com/gag/aAGZ6EL,Funny,2022-05-16 00:00:00.000000,When you deal with bullies and...,5600,434,258
https://9gag.com/gag/a71A9px,Relationship,2022-05-16 00:00:00.000000,Worth it.,1600,141,145
https://9gag.com/gag/ajgyO6q,WTF,2022-05-16 00:00:00.000000,What was that for?,6300,231,359
https://9gag.com/gag/aVxBLQn,WTF,2022-05-16 00:00:00.000000,"Remember when a Truck drivers ""two-faced"" pic with left half wrinkled due to constantly being under sunlight",3100,73,180
https://9gag.com/gag/aPZnXDK,Random,2022-05-17 00:00:00.000000,Skip this car man .,2300,58,52
https://9gag.com/gag/aXre2x6,WTF,2022-05-17 00:00:00.000000,A humbling message outside a cemetery in the middle of the woods,2100,112,76
https://9gag.com/gag/abgExnr,Funny,2022-05-16 00:00:00.000000,You got this...,6200,424,932
https://9gag.com/gag/aBnoX9D,Funny,2022-05-17 00:00:00.000000,Like ya maybe they aren't so bad lol,5900,449,351
https://9gag.com/gag/aBnoW82,Awesome,2022-05-14 00:00:00.000000,Great Animated Series for Adults,2000,119,219
https://9gag.com/gag/aQXV9Lq,Awesome,2022-05-14 00:00:00.000000,Bannana brain,2700,301,188
https://9gag.com/gag/aVxBMDv,WTF,2022-05-14 00:00:00.000000,Should’ve swallowed it.,1100,90,172
https://9gag.com/gag/a81zopV,Random,2022-05-14 00:00:00.000000,Egyptian God Family Tree,2200,72,207
https://9gag.com/gag/aKmpj81,Funny,2022-05-14 00:00:00.000000,Process is process <3,2600,63,92
https://9gag.com/gag/aOQGr4M,Awesome,2022-05-14 00:00:00.000000,This guy sold his nightclub to save thousands of dogs and other animals,5600,188,160
